{
  "artifact": "20",
  "checks": {
    "analysis_invariance": {
      "notes": "summaryとScoped Contentで主要なAnalysis構造は不変。",
      "status": "PASS"
    },
    "causality": {
      "notes": "受信→期限内転送／停止→幸運／不運という因果列と次受信者への連鎖が保持される。",
      "status": "PASS"
    },
    "content_layer_bypass": {
      "notes": "Analysisの意味論はScoped CNT-001〜006に存在し、Source/Evidence-only detailを直接追加していない。",
      "status": "PASS"
    },
    "d12_d13_d15_causal_chain": {
      "notes": "D12受信者→D13幸運／不運→D15吉凶領域という因果列はContentと接続する。",
      "status": "PASS"
    },
    "d18_scope_independent_x_evidence": {
      "notes": "L3はCNT-006に反映された実流行・警察対応とX Evidence EVD-002/EVD-005に基づく。",
      "status": "PASS"
    },
    "d19_publicability_vs_national_distribution": {
      "notes": "全国流通へ過大化せずREGIONALをIで採用している。",
      "status": "PASS"
    },
    "d20_missing_info_vs_no_one_knows": {
      "notes": "情報保持者不明をNO_ONE_KNOWSへ変換せずUとしている。",
      "status": "PASS"
    },
    "d21_reality_anchor": {
      "notes": "資料実在性ではなく一般的な郵便背景に依存する点からA1としている。",
      "status": "PASS"
    },
    "dimension_semantics": {
      "notes": "D02/D03を含め、各code semanticsとStatusはScoped ContentおよびEvidence支持強度に整合する。",
      "status": "PASS"
    },
    "entry_classification": {
      "notes": "情報・メタ伝説／規則・チェーン伝承はScoped Contentと整合する。",
      "status": "PASS"
    },
    "evidence_confidence_ceiling": {
      "notes": "D02/D03はderivative Evidenceへの依存を明示してIへ補正され、Analysisの確信度がEvidence支持強度を超えていない。",
      "status": "PASS"
    },
    "semantic_traceability": {
      "notes": "各Dimensionはversion_scope.content_refsのCNT-001〜006へ追跡できる。",
      "status": "PASS"
    },
    "status_reasoning": {
      "notes": "Seq 001で指摘したD02/D03はcodeを維持したままD→Iへ修正され、支持Evidenceの直接性と一致した。",
      "status": "PASS"
    },
    "taxonomy_gap": {
      "notes": "Scoped Contentの主要意味は現行taxonomyで表現できる。",
      "status": "PASS"
    },
    "version_scope": {
      "notes": "VAR-001の1922年型だけをScopeに含め、後代型を除外する境界はScoped Contentと整合する。",
      "status": "PASS"
    }
  },
  "entry_id": "0024",
  "findings": [],
  "review_notes": "Review Seq 002。Scoped Contentから再構成し、Seq 001 Finding F001のD02/D03 confidence correctionを確認した。新規Findingなし。",
  "review_seq": 2,
  "schema_version": "1.1",
  "sensemaking_reconstruction": {
    "content_refs": [
      "CNT-001",
      "CNT-002",
      "CNT-003",
      "CNT-004",
      "CNT-006"
    ],
    "dimension_refs": [
      "D05",
      "D06",
      "D07",
      "D08",
      "D09",
      "D10",
      "D11",
      "D12",
      "D13",
      "D14",
      "D15",
      "D16",
      "D17",
      "D18",
      "D19",
      "D21"
    ],
    "evidence_refs": [
      "EVD-001",
      "EVD-002",
      "EVD-003",
      "EVD-005"
    ],
    "model": "1922年型は、受信者がチェーンレターを受け取ることで規則へ入り、24時間以内に同文を9人へ転送すれば9日後の幸運、停止すれば大きな不運が来るとする条件付きの未来予告・制御規則である。転送は次受信者へ同じ規則を複製し、将来の吉凶を行為選択へ結び付ける。",
    "notes": "Seq 001の意味モデルは維持され、媒体Dimensionのconfidenceのみ適正化された。",
    "status": "PASS"
  },
  "target": {
    "artifact_path": "workspace/articles/f8fe59b49c2e1e/docs/10_each_lore/0024_kofuku_no_tegami/0024_20_analysis.json",
    "blob_sha": "93b30d705075d650e3834d3c7e598dbb9c414572",
    "commit_sha": "76f273a7a812a95e8b2cf6b994ba069a04173fb7",
    "reviewed_at": "2026-09-21T06:05:00Z"
  },
  "verdict": "Pass"
}
